{
 "$schema": "https://json-schema.org/draft/2020-12/schema",
 "title": "Dehesa Index - Francia: conjunto adicional de Agreste (tablas de series)",
 "type": "object",
 "required": [
  "schemaVersion",
  "generatedAt",
  "source",
  "edition",
  "tables"
 ],
 "properties": {
  "schemaVersion": {
   "type": "integer"
  },
  "generatedAt": {
   "type": "string",
   "pattern": "^\\d{4}-\\d{2}-\\d{2}T\\d{2}:\\d{2}"
  },
  "source": {
   "type": "object",
   "required": [
    "name",
    "url",
    "license"
   ],
   "properties": {
    "name": {
     "type": "string"
    },
    "url": {
     "type": "string",
     "pattern": "^https://"
    },
    "license": {
     "type": "string"
    }
   }
  },
  "edition": {
   "type": "string"
  },
  "tables": {
   "type": "array",
   "minItems": 1,
   "items": {
    "type": "object",
    "required": [
     "id",
     "label",
     "unit",
     "series"
    ],
    "properties": {
     "id": {
      "type": "string"
     },
     "label": {
      "type": "string"
     },
     "unit": {
      "type": "string"
     },
     "note": {
      "type": "string"
     },
     "series": {
      "type": "array",
      "minItems": 1,
      "items": {
       "type": "object",
       "required": [
        "id",
        "label",
        "points"
       ],
       "properties": {
        "id": {
         "type": "string"
        },
        "label": {
         "type": "string"
        },
        "points": {
         "type": "array",
         "minItems": 1,
         "items": {
          "type": "array",
          "minItems": 2,
          "maxItems": 2
         }
        },
        "provisional": {
         "type": "array",
         "items": {
          "type": "string"
         }
        },
        "depth": {
         "type": "integer"
        }
       }
      }
     }
    }
   }
  }
 }
}