{"schemaVersion":1,"generatedAt":"2026-10-23T23:00:07Z","source":{"name":"ZSRIR (Ministerstwo Rolnictwa i Rozwoju Wsi) - boletines de mercado en dane.gov.pl","url":"https://dane.gov.pl/pl/dataset/546","license":"CC0 1.0 (dane.gov.pl)"},"edition":"semana 2026-10-18","tables":[{"id":"colza-mensual","group":"colza","label":"Colza: precio de compra, mensual","l":{"en":"Rapeseed: purchase price, monthly","fr":"Colza : prix d'achat, mensuel","it":"Colza: prezzo d'acquisto, mensile"},"unit":"PLN/t","note":"Precio medio mensual de compra de semilla de colza (ZSRIR)","series":[{"id":"pl-colza-m-semilla","label":"Colza (semilla), compra, mensual","l":{"en":"Rapeseed (seed), purchase, monthly","fr":"Colza (graine), achat, mensuel","it":"Colza (semi), acquisto, mensile"},"points":[["2022-01",3356],["2022-02",3352],["2022-03",3556],["2022-04",4019],["2022-05",4612],["2022-06",4341],["2022-07",3434],["2022-08",3181],["2022-09",3039],["2022-10",3102],["2022-11",3094],["2022-12",2930],["2023-01",2818],["2023-02",2681],["2023-03",2470],["2023-04",2237],["2023-05",2081],["2023-06",1894],["2023-07",2019],["2023-08",2009],["2023-09",2015],["2023-10",2027],["2023-11",2025],["2023-12",2000],["2024-01",2010],["2024-02",1965],["2024-03",1905],["2024-04",1924],["2024-05",1953],["2024-06",2005],["2024-07",2030],["2024-08",2066],["2024-09",2088],["2024-10",2162],["2024-11",2327],["2024-12",2376],["2025-01",2438],["2025-02",2393.41],["2025-03",2436.41],["2025-04",2469.33],["2025-05",2418.74],["2025-06",2365.17],["2025-07",2093],["2025-08",1957.92],["2025-09",1998],["2025-10",2060],["2025-11",2094],["2025-12",2098],["2026-01",2115.81],["2026-02",2144.75],["2026-03",2209.95],["2026-04",2266.57],["2026-05",2303.49],["2026-06",2333.51],["2026-07",2314.31],["2026-08",2283.56],["2026-09",2436.62]]}]},{"id":"colza-semanal","group":"colza","label":"Colza: precio de compra, semanal","l":{"en":"Rapeseed: purchase price, weekly","fr":"Colza : prix d'achat, hebdomadaire","it":"Colza: prezzo d'acquisto, settimanale"},"unit":"PLN/t","note":"Precio medio semanal de compra de semilla de colza, semana de lunes a domingo (ZSRIR)","series":[{"id":"pl-colza-w-semilla","label":"Colza (semilla), compra, semanal","l":{"en":"Rapeseed (seed), purchase, weekly","fr":"Colza (graine), achat, hebdomadaire","it":"Colza (semi), acquisto, settimanale"},"points":[["2022-W01",3242],["2022-W02",3406],["2022-W03",3379],["2022-W04",3303],["2022-W05",3153],["2022-W06",3190],["2022-W07",3104],["2022-W08",3326],["2022-W09",3376],["2022-W10",3547],["2022-W11",3628],["2022-W12",3675],["2022-W13",3850],["2022-W14",4002],["2022-W15",4008],["2022-W16",4131],["2022-W17",4165],["2022-W18",4600],["2022-W19",4720],["2022-W20",4577],["2022-W21",4681],["2022-W22",4442],["2022-W23",4306],["2022-W24",4305],["2022-W25",4279],["2022-W26",4138.22],["2022-W27",4357],["2022-W28",3456],["2022-W29",3161],["2022-W30",3146],["2022-W31",3195],["2022-W32",3187],["2022-W33",3212],["2022-W34",3170.33],["2022-W35",3115],["2022-W36",3112],["2022-W37",3050],["2022-W38",2884],["2022-W39",2961],["2022-W40",3245],["2022-W41",3008],["2022-W42",3101],["2022-W43",3141],["2022-W44",2988],["2022-W45",3121],["2022-W46",3096],["2022-W47",3169],["2022-W48",3067],["2022-W49",3126],["2022-W50",3006],["2022-W51",2962],["2022-W52",2920.29],["2023-W01",2891],["2023-W02",2855],["2023-W03",2758],["2023-W04",2764],["2023-W05",2679],["2023-W06",2693],["2023-W07",2671],["2023-W08",2682],["2023-W09",2658],["2023-W10",2586],["2023-W11",2501],["2023-W12",2329],["2023-W13",2379],["2023-W14",2328],["2023-W15",2151],["2023-W16",2291],["2023-W17",2202],["2023-W18",2162],["2023-W19",2119.47],["2023-W20",2118],["2023-W21",2046],["2023-W22",1877],["2023-W23",1914],["2023-W24",1890],["2023-W25",1882],["2023-W26",1887],["2023-W27",1918],["2023-W28",1954],["2023-W29",2022],["2023-W30",2034],["2023-W31",1986],["2023-W32",2007],["2023-W33",2043],["2023-W34",2006],["2023-W35",2070],["2023-W36",2004],["2023-W37",1994],["2023-W38",2013],["2023-W39",2022],["2023-W40",2019],["2023-W41",2008],["2023-W42",2049],["2023-W43",2038],["2023-W44",2040],["2023-W45",2037],["2023-W46",2011],["2023-W47",2012],["2023-W48",2033],["2023-W49",1989.65],["2023-W50",2024],["2023-W51",1984],["2023-W52",1925],["2024-W01",2025],["2024-W02",2036],["2024-W03",2023],["2024-W04",2009],["2024-W05",1975],["2024-W06",2004],["2024-W07",1965],["2024-W08",1952],["2024-W09",1929],["2024-W10",1911],["2024-W11",1900],["2024-W12",1902],["2024-W13",1906],["2024-W14",1911],["2024-W15",1913],["2024-W16",1926],["2024-W17",1936],["2024-W18",1934],["2024-W19",1944],["2024-W20",1955],["2024-W21",1956],["2024-W22",1970],["2024-W23",2009],["2024-W24",2003],["2024-W25",2002],["2024-W26",2003],["2024-W27",2046],["2024-W28",2015],["2024-W29",2024],["2024-W30",2045],["2024-W31",2037],["2024-W32",2044],["2024-W33",2081],["2024-W34",2074],["2024-W35",2039],["2024-W36",2012],["2024-W37",2073],["2024-W38",2090],["2024-W39",2088],["2024-W40",2123],["2024-W41",2137.33],["2024-W42",2152.51],["2024-W43",2204.28],["2024-W44",2226],["2024-W45",2298],["2024-W46",2323],["2024-W47",2328.89],["2024-W48",2357.51],["2024-W49",2347.29],["2024-W50",2393],["2024-W51",2406.7],["2024-W52",2376.2],["2025-W01",2462.2],["2025-W02",2448.97],["2025-W03",2438.17],["2025-W04",2442.43],["2025-W05",2424.45],["2025-W06",2386],["2025-W07",2402.84],["2025-W08",2399],["2025-W09",2388.2],["2025-W10",2458],["2025-W11",2466.87],["2025-W12",2439.96],["2025-W13",2400],["2025-W14",2428.85],["2025-W15",2478.71],["2025-W16",2479.68],["2025-W17",2495.22],["2025-W18",2484.71],["2025-W19",2448.11],["2025-W20",2433.35],["2025-W21",2375.16],["2025-W22",2422],["2025-W23",2370.4],["2025-W24",2364.34],["2025-W25",2403.36],["2025-W26",2390.83],["2025-W27",2316],["2025-W28",2278],["2025-W29",2159.75],["2025-W30",2068],["2025-W31",2072.6],["2025-W32",1933.71],["2025-W33",1935.18],["2025-W34",1956.69],["2025-W35",1993.51],["2025-W36",2010.06],["2025-W37",2000.3],["2025-W38",2006],["2025-W39",2007],["2025-W40",1968],["2025-W41",2012],["2025-W42",2063.27],["2025-W43",2076.45],["2025-W44",2076.45],["2025-W45",2094],["2025-W46",2098],["2025-W47",2098],["2025-W48",2109],["2025-W49",2124.43],["2025-W50",2110.13],["2025-W51",2067.17],["2025-W52",2081.94],["2026-W01",2114.79],["2026-W02",2129.47],["2026-W03",2114.49],["2026-W04",2111.58],["2026-W05",2124],["2026-W06",2147.06],["2026-W07",2149.52],["2026-W08",2163.09],["2026-W09",2172.52],["2026-W10",2217],["2026-W11",2260.77],["2026-W12",2243],["2026-W13",2244.61],["2026-W14",2264.06],["2026-W15",2258.97],["2026-W16",2279.03],["2026-W17",2272.97],["2026-W18",2269.93],["2026-W19",2303.66],["2026-W20",2307],["2026-W21",2291],["2026-W22",2313],["2026-W23",2336.05],["2026-W24",2237],["2026-W25",2383.71],["2026-W26",2276.54],["2026-W27",2139],["2026-W28",2329.71],["2026-W29",2318.54],["2026-W30",2330.44],["2026-W31",2298.11],["2026-W32",2239.46],["2026-W33",2263.6],["2026-W34",2323.97],["2026-W35",2304.85],["2026-W36",2318.03],["2026-W37",2392.58],["2026-W38",2466.56],["2026-W39",2469.76],["2026-W40",2464.51],["2026-W41",2500.63],["2026-W42",2505.26]]}]}]}